{
  "acceptance_tests": [
    "cd services/landing-web && npm run build",
    "test -f slices/TMP-022-landing-web-dynamic-route-build/value-gate-report.md"
  ],
  "assignment": {
    "decision": "allow",
    "reason": "declared_class_valid",
    "runtime_tier": "MED"
  },
  "class": "vertical_defect_slice",
  "context": {
    "hydrate_on_demand": true,
    "max_initial_tokens": 1200,
    "mode": "capsule_first",
    "required_context_refs": [
      "agent/backlog/issues/TMP-022-landing-web-dynamic-route-build.md"
    ]
  },
  "created_at": "2026-06-08T05:39:40Z",
  "dependencies": {
    "blocks": [],
    "depends_on": []
  },
  "goal_id": "goal-legacy-TMP-022",
  "hashes": {
    "classification_hash": "sha256:5fe18ac65f62e9da2494b645757b7e39e4109060ddb1237af4fa2fcde72fb4d4",
    "contract_hash": "sha256:6bb5388721674c7aa8a15811c2349066d5f8b8817e90789555e13d2cb809808c",
    "issue_hash": "sha256:6cc20dea900622fd655d628a33dc497c7241fb74ff935506bbaab44fb3e27041"
  },
  "issue_id": "TMP-022",
  "non_goals": [
    "No Next.js dependency upgrade.",
    "No visual redesign.",
    "No acquisition API contract change."
  ],
  "objective": {
    "actor": "end-subscriber",
    "entrypoint": "services/landing-web/app/lp routes and services/landing-web/app/api/campaigns routes",
    "outcome": "Landing pages can be built for production while preserving legacy single-slug and tenant-qualified campaign URLs.",
    "trigger": "Operator runs `npm run build` for landing-web"
  },
  "parallelism": {
    "max_parallel_group_size": 1,
    "parallel_group": null,
    "parallel_safe": false,
    "requires_isolated_worktree": true
  },
  "required_evidence": [
    "npm run build",
    "slices/TMP-022-landing-web-dynamic-route-build/value-gate-report.md"
  ],
  "schema_version": "2.0",
  "scope": {
    "allowed_files": [
      "services/landing-web/app/api/campaigns/**",
      "services/landing-web/app/lp/**",
      "slices/TMP-022-landing-web-dynamic-route-build/**",
      "slices/manifest.json",
      "agent/backlog/issues/TMP-022-landing-web-dynamic-route-build.md",
      "agent/state/TMP-022.work-order.json",
      ".agent/**",
      ".harness/**"
    ],
    "forbidden_files": [
      "services/landing-web/package.json",
      "services/landing-web/package-lock.json",
      "common/**",
      "services/**/go.mod",
      "services/**/go.sum"
    ],
    "read_scopes": [],
    "write_locks": [
      "services/landing-web/app/api/campaigns/**",
      "services/landing-web/app/lp/**",
      "slices/TMP-022-landing-web-dynamic-route-build/**",
      "slices/manifest.json",
      "agent/backlog/issues/TMP-022-landing-web-dynamic-route-build.md",
      "agent/state/TMP-022.work-order.json",
      ".agent/**",
      ".harness/**"
    ]
  },
  "work_order_id": "WO-TMP-022-001",
  "required_skills": [
    "repository-codebase-governance"
  ]
}
