{
  "acceptance_tests": [
    "agent-hub schema validate --schema work_order_v2 --file <work-order>",
    "The requested outcome is implemented with evidence and tests.",
    "agent-hub evidence verify --work-order <work-order>"
  ],
  "assignment": {
    "decision": "allow",
    "reason": "Inferred bounded_enabler from GoalSpec classification hints and prompt terms.",
    "runtime_tier": "MED"
  },
  "class": "bounded_enabler",
  "context": {
    "hydrate_on_demand": true,
    "max_initial_tokens": 1800,
    "mode": "capsule_first",
    "required_context_refs": [
      "schemas/goal-spec.schema.json",
      "schemas/work-order.v2.schema.json"
    ]
  },
  "created_at": "2026-06-09T08:03:26Z",
  "dependencies": {
    "blocks": [],
    "depends_on": []
  },
  "goal_id": "goal-20260609T080226Z-run-pending-migrations-a",
  "hashes": {
    "classification_hash": "sha256:45d32059d624865308e441bbb8faaf0808600b48bbaaebe31e82298ded928e44",
    "contract_hash": "sha256:57ceedc2f4a2215914eb2a162189ad15c1c1a083d0c175bf82ea947dcfa34543",
    "issue_hash": "sha256:ce2da06ba41e294165352231630dd59c2e62d0e57ef732fdb3e27baa43e1c8ae"
  },
  "issue_id": "ISSUE-RUN-PENDING-MIGRATIONS-AND-PROCEED-WITH",
  "non_goals": [
    "Do not perform unrelated repository-wide rewrites."
  ],
  "objective": {
    "actor": "agent-hub workflow worker",
    "entrypoint": "agent-hub graph run",
    "outcome": "Run pending migrations and proceed with migrating and moving all tenant config settings",
    "trigger": "Run pending migrations and proceed with migrating and moving all tenant config settings"
  },
  "parallelism": {
    "max_parallel_group_size": 4,
    "parallel_group": "wave-001",
    "parallel_safe": true,
    "requires_isolated_worktree": true
  },
  "required_evidence": [
    "schema_validation",
    "dispatch_ready_report",
    "review_gate_result"
  ],
  "required_skills": [
    "repository-codebase-governance",
    "security-supply-chain",
    "backend-contract-first"
  ],
  "schema_version": "2.0",
  "scope": {
    "allowed_files": [
      "policies/security/**",
      "tests/**",
      "docs/**"
    ],
    "forbidden_files": [
      ".git/**",
      "secrets/**",
      "**/.env",
      "policies/global/**"
    ],
    "read_scopes": [
      "schemas/**",
      "policies/**",
      "skills/**"
    ],
    "write_locks": [
      "policies/security/**"
    ]
  },
  "work_order_id": "WO-RUN-PENDING-MIGRATIONS-AND-PROCEED-WITH-MIGRATIN"
}
