{
  "acceptance_tests": [
    "test ! -f .gitmodules",
    "test -f frontend/webspa-admin/package.json",
    "git ls-files -s frontend/webspa-admin | head",
    "cd frontend/webspa-admin && npm ci",
    "cd frontend/webspa-admin && npm run build",
    "cd frontend/webspa-admin && CHROME_BIN=/usr/bin/google-chrome-stable npm test -- --watch=false --browsers=ChromeHeadless --progress=false"
  ],
  "assignment": {
    "decision": "allow",
    "reason": "declared_class_valid; observable_reproducibility_defect",
    "runtime_tier": "MED"
  },
  "class": "vertical_defect_slice",
  "context": {
    "hydrate_on_demand": true,
    "max_initial_tokens": 1200,
    "mode": "capsule_first",
    "required_context_refs": [
      "agent/backlog/issues/TMP-046-webspa-admin-reproducible-source.md"
    ]
  },
  "created_at": "2026-06-08T05:39:41Z",
  "dependencies": {
    "blocks": [],
    "depends_on": []
  },
  "goal_id": "goal-legacy-TMP-046",
  "hashes": {
    "classification_hash": "sha256:d975070989c16abc768942f899adf40cac180650e6119957b07bf08455d780f7",
    "contract_hash": "sha256:af22ba8e360f572b69e96252f22e5700e4c604f8f259c6d78d6adfd69ad21570",
    "issue_hash": "sha256:fd11630909511370b7746cbe7b39b27592786968bebedd3efb63bf12dd24295b"
  },
  "issue_id": "TMP-046",
  "non_goals": [
    "Changing admin UI behavior beyond preserving the pinned checkout source.",
    "Changing service code.",
    "Resolving dependency vulnerabilities in webspa-admin."
  ],
  "objective": {
    "actor": "platform-operator",
    "entrypoint": "frontend/webspa-admin tracked source directory",
    "outcome": "Admin frontend verification no longer depends on an unavailable submodule commit while preserving the tenant admin source that passed local verification.",
    "trigger": "Verifier tries to reproduce the admin frontend from a clean superproject checkout."
  },
  "parallelism": {
    "max_parallel_group_size": 1,
    "parallel_group": null,
    "parallel_safe": false,
    "requires_isolated_worktree": true
  },
  "required_evidence": [
    "frontend/webspa-admin/package.json",
    "slices/TMP-046-webspa-admin-reproducible-source/value-gate-report.md",
    "slices/TMP-026-webspa-submodule-verification/value-gate-report.md"
  ],
  "schema_version": "2.0",
  "scope": {
    "allowed_files": [
      ".gitmodules",
      "frontend/webspa-admin/**",
      "agent/backlog/issues/TMP-026-webspa-submodule-verification.md",
      "agent/backlog/issues/TMP-046-webspa-admin-reproducible-source.md",
      "agent/state/TMP-026.work-order.json",
      "agent/state/TMP-046.work-order.json",
      "agent/state/TMP-046.handoff.json",
      "slices/manifest.json",
      "slices/TMP-026-webspa-submodule-verification/**",
      "slices/TMP-046-webspa-admin-reproducible-source/**",
      ".agent/**",
      ".harness/**"
    ],
    "forbidden_files": [
      "services/**",
      "common/**",
      "ops/**",
      "docker-compose*.yml",
      "Makefile",
      "go.mod",
      "go.sum"
    ],
    "read_scopes": [],
    "write_locks": [
      ".gitmodules",
      "frontend/webspa-admin/**",
      "agent/backlog/issues/TMP-026-webspa-submodule-verification.md",
      "agent/backlog/issues/TMP-046-webspa-admin-reproducible-source.md",
      "agent/state/TMP-026.work-order.json",
      "agent/state/TMP-046.work-order.json",
      "agent/state/TMP-046.handoff.json",
      "slices/manifest.json",
      "slices/TMP-026-webspa-submodule-verification/**",
      "slices/TMP-046-webspa-admin-reproducible-source/**",
      ".agent/**",
      ".harness/**"
    ]
  },
  "work_order_id": "WO-TMP-046-001",
  "required_skills": [
    "repository-codebase-governance"
  ]
}
