{
  "acceptance_tests": [
    "cd services/subscription-partner && go test ./...",
    "cd services/notification && go test ./...",
    "make build-all-local",
    "jq empty slices/manifest.json agent/state/TMP-027.work-order.json",
    "hvc check agent/backlog/issues/*.md --fail-on block",
    "slice-harness sync --dry-run"
  ],
  "assignment": {
    "decision": "allow",
    "reason": "declared_class_valid",
    "runtime_tier": "HIGH"
  },
  "class": "operational_slice",
  "context": {
    "hydrate_on_demand": true,
    "max_initial_tokens": 1200,
    "mode": "capsule_first",
    "required_context_refs": [
      "agent/backlog/issues/TMP-027-release-matrix-stale-blocker-reconciliation.md"
    ]
  },
  "created_at": "2026-06-08T05:39:40Z",
  "dependencies": {
    "blocks": [],
    "depends_on": []
  },
  "goal_id": "goal-legacy-TMP-027",
  "hashes": {
    "classification_hash": "sha256:a711aaf2f054562c49a4e9237301a79cea9a56c4351c4d68cb68f92d7982fa30",
    "contract_hash": "sha256:845ceb80ee031654b813faa4f4757c81f19817ee104307691f8e911714f927e1",
    "issue_hash": "sha256:4ccd74d414e90e2069ee5c338605af6241f61492e986e6c4fb1f05e92f094e5a"
  },
  "issue_id": "TMP-027",
  "non_goals": [],
  "objective": {
    "actor": "platform-operator",
    "entrypoint": "docs/agent/full-system-verification-2026-05-09.md",
    "outcome": "Operator-inspectable release matrix accurately reflects current Go test and build pass evidence while keeping remaining real blockers visible.",
    "trigger": "Operator reviews current full-system verification state after new origin/main evidence."
  },
  "parallelism": {
    "max_parallel_group_size": 1,
    "parallel_group": null,
    "parallel_safe": false,
    "requires_isolated_worktree": true
  },
  "required_evidence": [
    "cd services/subscription-partner && go test ./...",
    "cd services/notification && go test ./...",
    "make build-all-local",
    "slices/TMP-027-release-matrix-stale-blocker-reconciliation/value-gate-report.md",
    "agent/state/TMP-021.handoff.json"
  ],
  "schema_version": "2.0",
  "scope": {
    "allowed_files": [
      "docs/agent/full-system-verification-2026-05-09.md",
      "slices/manifest.json",
      "slices/TMP-021-full-system-verification/value-gate-report.md",
      "slices/TMP-027-release-matrix-stale-blocker-reconciliation/**",
      "agent/backlog/issues/TMP-027-release-matrix-stale-blocker-reconciliation.md",
      "agent/state/TMP-027.work-order.json",
      "agent/state/TMP-027.handoff.json",
      "agent/state/TMP-021.handoff.json",
      ".agent/**",
      ".harness/**"
    ],
    "forbidden_files": [
      "common/**",
      "services/**",
      "frontend/**",
      "go.mod",
      "go.sum",
      "package.json",
      "package-lock.json",
      "vendor/**"
    ],
    "read_scopes": [],
    "write_locks": [
      "docs/agent/full-system-verification-2026-05-09.md",
      "slices/manifest.json",
      "slices/TMP-021-full-system-verification/value-gate-report.md",
      "slices/TMP-027-release-matrix-stale-blocker-reconciliation/**",
      "agent/backlog/issues/TMP-027-release-matrix-stale-blocker-reconciliation.md",
      "agent/state/TMP-027.work-order.json",
      "agent/state/TMP-027.handoff.json",
      "agent/state/TMP-021.handoff.json",
      ".agent/**",
      ".harness/**"
    ]
  },
  "work_order_id": "WO-TMP-027-001",
  "required_skills": [
    "repository-codebase-governance"
  ]
}
