{
  "acceptance_tests": [
    "hvc check agent/backlog/issues/TMP-064-admin-sentry-angular18-peer.md --fail-on block",
    "cd frontend/webspa-admin && npm install --ignore-scripts",
    "cd frontend/webspa-admin && npm run build"
  ],
  "assignment": {
    "decision": "allow",
    "reason": "declared_class_valid",
    "runtime_tier": "MED"
  },
  "class": "vertical_defect_slice",
  "context": {
    "hydrate_on_demand": true,
    "max_initial_tokens": 1200,
    "mode": "capsule_first",
    "required_context_refs": [
      "agent/backlog/issues/TMP-064-admin-sentry-angular18-peer.md"
    ]
  },
  "created_at": "2026-06-08T05:39:41Z",
  "dependencies": {
    "blocks": [],
    "depends_on": []
  },
  "goal_id": "goal-legacy-TMP-064",
  "hashes": {
    "classification_hash": "sha256:d8b13abf22aa4b28b3f71a6a611cdb90cc216e93f9a4ae8d45662df8c67aa793",
    "contract_hash": "sha256:823cf08547c0958352c324f0535ec4c7935bce8e693d57847a0aa0bdcc40faac",
    "issue_hash": "sha256:cae3df5c7646a5f9e1b32fbc54adfdbc3c3ace9af3b519ed6936ae925a0aaf59"
  },
  "issue_id": "TMP-064",
  "non_goals": [],
  "objective": {
    "actor": "developer",
    "entrypoint": "cd frontend/webspa-admin && npm install",
    "outcome": "The admin panel dependencies install cleanly under Angular 18 without forcing or bypassing npm peer dependency resolution.",
    "trigger": "Developer starts or installs the admin panel dependencies."
  },
  "parallelism": {
    "max_parallel_group_size": 1,
    "parallel_group": null,
    "parallel_safe": false,
    "requires_isolated_worktree": true
  },
  "required_evidence": [
    "npm install without --legacy-peer-deps",
    "npm run build",
    "hvc check agent/backlog/issues/TMP-064-admin-sentry-angular18-peer.md --fail-on block"
  ],
  "schema_version": "2.0",
  "scope": {
    "allowed_files": [
      "frontend/webspa-admin/package.json",
      "frontend/webspa-admin/package-lock.json",
      "frontend/webspa-admin/src/main.ts",
      "frontend/webspa-admin/src/app/app.module.ts",
      "agent/backlog/issues/TMP-064-admin-sentry-angular18-peer.md",
      "agent/state/TMP-064.work-order.json",
      "agent/state/TMP-064.handoff.json",
      ".agent/**",
      ".harness/**"
    ],
    "forbidden_files": [
      "services/**",
      "frontend/webspa-admin/src/app/features/**",
      "frontend/webspa-admin/src/app/core/http-interceptors/**",
      "frontend/webspa-admin/angular.json",
      "docker-compose*.yml"
    ],
    "read_scopes": [],
    "write_locks": [
      "frontend/webspa-admin/package.json",
      "frontend/webspa-admin/package-lock.json",
      "frontend/webspa-admin/src/main.ts",
      "frontend/webspa-admin/src/app/app.module.ts",
      "agent/backlog/issues/TMP-064-admin-sentry-angular18-peer.md",
      "agent/state/TMP-064.work-order.json",
      "agent/state/TMP-064.handoff.json",
      ".agent/**",
      ".harness/**"
    ]
  },
  "work_order_id": "WO-TMP-064-001",
  "required_skills": [
    "repository-codebase-governance"
  ]
}
